{
  "$schema": "./schemas/runtime-ingress-inventory.schema.json",
  "schemaVersion": 1,
  "evidenceId": "P0.W2.RUNTIME_INGRESS_INVENTORY",
  "phaseStartSha": "c72fd201867b9bcd1ef77d5e0f95ba379adb4fca",
  "authoredBy": "phase-00-remediation-w2-final-r1-source-review",
  "validatedBy": "scripts/hosted-web/phase-0/provider-runtime/scan-runtime-surfaces.ts",
  "claimStatus": "current_source_observed; target_mapping_unimplemented",
  "records": [
    {
      "id": "runtime-bootstrap-checkin",
      "operation": "bootstrap",
      "commandKind": "runtime.bootstrap-checkin",
      "currentRoute": "/api/teams/:teamName/opencode/runtime/bootstrap-checkin",
      "direction": "runtime_to_app",
      "caller": "OpenCode agent/MCP compatibility callback",
      "currentAuthority": "route teamName plus body runId/memberName/runtimeSessionId; lane is server-resolved, but no route-specific machine credential is checked",
      "idempotency": "derived commandId; durable session evidence treats same session as duplicate and rejects a conflicting session",
      "bodyIds": ["teamName", "runId", "memberName", "runtimeSessionId"],
      "persistedEvidence": [
        "lane manifest",
        "opencode-sessions.json",
        "launch-state.json",
        "runtime run tombstone check"
      ],
      "targetDisposition": "move_to_lane_scoped_machine_ingress",
      "source": "src/main/services/team/provisioning/TeamProvisioningOpenCodeRuntimeCheckin.ts"
    },
    {
      "id": "runtime-deliver-message",
      "operation": "delivery",
      "commandKind": "runtime.deliver-message",
      "currentRoute": "/api/teams/:teamName/opencode/runtime/deliver-message",
      "direction": "runtime_to_app",
      "caller": "OpenCode runtime callback",
      "currentAuthority": "body chooses source and user/member/cross-team target; current-run tombstone is checked, but canonical sender/target authorization is not credential-derived",
      "idempotency": "persisted key plus payload hash; duplicate resumes/verifies destination and conflicting reuse is rejected",
      "bodyIds": [
        "teamName",
        "runId",
        "fromMemberName",
        "runtimeSessionId",
        "idempotencyKey",
        "to"
      ],
      "persistedEvidence": [
        "lane opencode-delivery-journal.json",
        "sent messages/inbox/cross-team outbox destination"
      ],
      "targetDisposition": "derive_sender_lane_and_reauthorize_target",
      "source": "src/main/services/team/opencode/delivery/RuntimeDeliveryService.ts"
    },
    {
      "id": "runtime-task-event",
      "operation": "task",
      "commandKind": "runtime.task-event",
      "currentRoute": "/api/teams/:teamName/opencode/runtime/task-event",
      "direction": "runtime_to_app",
      "caller": "OpenCode runtime callback",
      "currentAuthority": "body selects member/task/event; lane and current run are checked but task mutation authorization is not credential-derived",
      "idempotency": "key is required and included in commandId; underlying attribution upsert is durable, but normalized-intent conflict evidence is not present at this boundary",
      "bodyIds": [
        "teamName",
        "runId",
        "memberName",
        "taskId",
        "runtimeSessionId",
        "idempotencyKey"
      ],
      "persistedEvidence": ["opencode-task-log-attribution.json", "task-log-change notification"],
      "targetDisposition": "lane_scope_and_add_normalized_intent_fingerprint",
      "source": "src/main/services/team/provisioning/TeamProvisioningOpenCodeRuntimeCheckin.ts"
    },
    {
      "id": "runtime-heartbeat",
      "operation": "heartbeat",
      "commandKind": "runtime.heartbeat",
      "currentRoute": "/api/teams/:teamName/opencode/runtime/heartbeat",
      "direction": "runtime_to_app",
      "caller": "OpenCode runtime callback",
      "currentAuthority": "body run/member/session plus server-resolved lane and current-run tombstone check; no lane credential",
      "idempotency": "commandId includes observedAt; liveness snapshot write is repeatable, but no persisted monotonic sequence is enforced",
      "bodyIds": ["teamName", "runId", "memberName", "runtimeSessionId", "observedAt"],
      "persistedEvidence": [
        "launch-state.json lastHeartbeatAt/runtime evidence",
        "member-spawn change"
      ],
      "targetDisposition": "lane_scope_and_require_bounded_sequence_or_freshness",
      "source": "src/main/services/team/provisioning/TeamProvisioningOpenCodeRuntimeCheckin.ts"
    },
    {
      "id": "runtime-permission-answer",
      "operation": "permission",
      "commandKind": "runtime.permission-answer",
      "currentRoute": null,
      "direction": "operator_to_runtime_non_network",
      "caller": "trusted non-HTTP application compatibility boundary",
      "currentAuthority": "no HTTP route is registered; trusted application callers reach runtime control through the process-local compatibility boundary",
      "idempotency": "derived from requestId+decision; bridge command ledger may recover the provider effect, but ingress claim is not durably persisted first",
      "bodyIds": [
        "teamName",
        "runId",
        "laneId",
        "memberName",
        "requestId",
        "decision",
        "cwd",
        "expectedMembers"
      ],
      "persistedEvidence": [
        "runtime approval/bridge command evidence when available",
        "RuntimePermissionAnswered event only if an event sink is configured"
      ],
      "targetDisposition": "replace_with_runtime_permission_request_and_operator_decision_outbound",
      "source": "src/main/services/team/provisioning/TeamProvisioningOpenCodeRuntimePermissionAnswerBoundary.ts"
    }
  ],
  "trustSurfaceProof": {
    "currentNegativeControl": "Four runtime callbacks remain under /api/teams and register beside browser/operator routes; runtime.permission-answer is a non-network domain command with no currentRoute. Source contains no /api/runtime/v1 route or lane credential check.",
    "targetBrowserAuthority": "/api/hosted/v1/* uses operator session plus CSRF/Origin and cannot present runtime credentials.",
    "targetRuntimeAuthority": "/api/runtime/v1/runs/:runId/* uses only hash-verified lane/run-scoped relay credentials, ignores browser session/CSRF semantics, and cannot invoke operator verbs.",
    "targetProviderExposure": "Provider process receives a narrow local relay, never the canonical bearer in argv, env, settings, MCP config or run files.",
    "authorityIntersection": [],
    "operatorOnlyActions": [
      "provider.management.*",
      "team.lifecycle.launch",
      "team.lifecycle.stop",
      "team.lifecycle.delete",
      "permission.decision"
    ],
    "runtimeOnlyActions": [
      "runtime.bootstrap-checkin",
      "runtime.deliver-message",
      "runtime.task-event",
      "runtime.heartbeat",
      "runtime.permission-request"
    ],
    "verificationStatus": "proposed_mapping_proved_disjoint_by_route_and_credential_rules; implementation remains target-unverified"
  }
}
